appid,name,developer,publisher,score_rank,positive,negative,userscore,owners,average_forever,average_2weeks,median_forever,median_2weeks,price,initialprice,discount,ccu,languages,genre,tags
470220,UNO,Ubisoft Entertainment,Ubisoft Entertainment,,32605,11768,0,"2,000,000 .. 5,000,000",300,73,181,123,999,999,0,261,"English, French, Italian, German, Spanish - Spain, Russian, Japanese, Simplified Chinese, Traditional Chinese, Dutch, Portuguese - Brazil",Casual,Card Game;Multiplayer;Tabletop;Board Game;Casual;Family Friendly;Funny;Strategy;War;Co-op;Online Co-Op;Singleplayer;Classic;Cult Classic;Replay Value;Team-Based;Local Multiplayer;Action;Party Game;PvP
376210,The Isle,Afterthought LLC,Afterthought LLC,,51787,10548,0,"2,000,000 .. 5,000,000",6553,2485,685,3533,1999,1999,0,4707,English,Action;Adventure;Indie;Massively Multiplayer;Simulation;Early Access,Dinosaurs;Survival;Open World;Multiplayer;Simulation;Hunting;Massively Multiplayer;Realistic;Adventure;Early Access;Action;Third Person;Co-op;Sandbox;Horror;Walking Simulator;Indie;Strategy;Team-Based;RPG
1259420,Days Gone,Bend Studio,PlayStation PC LLC,,54190,4203,0,"2,000,000 .. 5,000,000",1403,476,1021,499,4999,4999,0,3260,"English, French, Italian, German, Spanish - Spain, Korean, Portuguese - Portugal, Portuguese - Brazil, Czech, Danish, Dutch, Finnish, Greek, Hungarian, Norwegian, Polish, Russian, Spanish - Latin America, Swedish, Traditional Chinese, Turkish, Japanese",Action;Adventure,Open World;Zombies;Singleplayer;Post-apocalyptic;Survival;Multiplayer;Action;Action-Adventure;Third Person;Open World Survival Craft;Adventure;Story Rich;Horror;Crafting;Motorbike;Survival Horror;Third-Person Shooter;Violent;Gore;Cinematic
12200,Bully: Scholarship Edition,Rockstar New England,Rockstar Games,,22390,4068,0,"2,000,000 .. 5,000,000",758,3,264,3,1499,1499,0,211,"Italian, German, Spanish - Spain, English, French",Action;Adventure,Open World;Action;Adventure;Third Person;Comedy;Singleplayer;Great Soundtrack;Funny;Classic;Dark Humor;Sandbox;Story Rich;Satire;Atmospheric;Exploration;Mature;Simulation;Controller;Multiplayer;RPG
40800,Super Meat Boy,Team Meat,,,29857,1652,0,"500,000 .. 1,000,000",343,61,149,61,1499,1499,0,244,"English, Russian",Indie,Precision Platformer;Platformer;Difficult;Indie;2D Platformer;Pixel Graphics;2D;Singleplayer;Great Soundtrack;Fast-Paced;Retro;Controller;Unforgiving;Gore;Action;Time Attack;Funny;Comedy;Side Scroller;Replay Value
285900,Gang Beasts,"Boneloaf, Coatsink",Boneloaf,,39024,8272,0,"2,000,000 .. 5,000,000",405,86,187,121,1999,1999,0,641,"English, French, Italian, German, Spanish - Spain, Portuguese - Brazil",Action;Adventure;Casual;Indie;Simulation,Funny;Physics;Multiplayer;Colorful;Party Game;Party;Local Multiplayer;Fighting;Comedy;3D Fighter;Casual;Soundtrack;4 Player Local;Co-op;Family Friendly;Beat 'em up;Memes;Third Person;Singleplayer;Indie
7940,Call of Duty 4: Modern Warfare (2007),Infinity Ward,Activision,,19092,1324,0,"2,000,000 .. 5,000,000",1474,11,565,11,1999,1999,0,464,"English, French, German, Italian, Spanish - Spain",Action,FPS;Action;Multiplayer;Shooter;Singleplayer;First-Person;Classic;Military;War;PvP;Great Soundtrack;Story Rich;Linear;Modern;Co-op;Controller;Atmospheric;Moddable;Competitive;Zombies
436520,Line of Sight,BlackSpot Entertainment,BlackSpot Entertainment,,5400,3708,0,"2,000,000 .. 5,000,000",119,0,41,0,0,0,0,49,English,Action;Free to Play;Indie;Massively Multiplayer,Free to Play;FPS;Action;Multiplayer;Shooter;Gun Customization;First-Person;Military;Character Customization;Open World;Singleplayer;Zombies;Survival;War;Controller;Co-op;Competitive;Strategy;Adventure;Indie
1522820,Orcs Must Die! 3,Robot Entertainment,Robot Entertainment,,8905,1605,0,"2,000,000 .. 5,000,000",835,0,526,0,2999,2999,0,310,"English, French, Italian, German, Spanish - Spain, Arabic, Czech, Danish, Finnish, Japanese, Korean, Norwegian, Polish, Portuguese - Portugal, Portuguese - Brazil, Russian, Simplified Chinese, Swedish, Turkish",Action;Adventure;Indie;Strategy,Tower Defense;Co-op;Strategy;Third-Person Shooter;PvE;Action;3D;Third Person;Funny;Multiplayer;Online Co-Op;Fantasy;Adventure;Combat;Co-op Campaign;Singleplayer;Physics;Stylized;Comedy;Cartoony
35140,Batman: Arkham Asylum Game of the Year Edition,Rocksteady Studios,Warner Bros. Interactive Entertainment,,48422,1839,0,"2,000,000 .. 5,000,000",704,1076,468,1076,1999,1999,0,347,"English, French, German, Italian, Spanish - Spain",Action;Adventure,Action;Stealth;Third Person;Superhero;Adventure;Singleplayer;Open World;Beat 'em up;Detective;Comic Book;Atmospheric;Story Rich;Action-Adventure;Fighting;Controller;Metroidvania;Puzzle;3D Vision;Horror;Dark
239030,"Papers, Please",Lucas Pope,3909,,57335,1730,0,"2,000,000 .. 5,000,000",401,429,266,429,999,999,0,451,"English, French, German, Spanish - Spain, Portuguese - Brazil, Russian, Italian, Japanese, Polish, Ukrainian, Czech, Simplified Chinese, Turkish, Basque, Korean",Adventure;Indie,Indie;Political;Simulation;Singleplayer;Point & Click;Pixel Graphics;Dystopian ;Multiple Endings;Puzzle;Story Rich;Retro;Atmospheric;2D;Great Soundtrack;Addictive;Strategy;Replay Value;Casual;Adventure;Difficult
1057240,Crucible Beta,Relentless Studios,Amazon Games,,4712,6237,0,"2,000,000 .. 5,000,000",127,0,67,0,0,0,0,0,"English, French, Italian, German, Spanish - Spain, Polish, Portuguese - Brazil, Spanish - Latin America",Action;Free to Play,Free to Play;Action;PvP;Shooter;Multiplayer;Team-Based;Hero Shooter;PvE;Sci-fi;MOBA;Third-Person Shooter;Battle Royale;Early Access;Third Person;FPS;Online Co-Op;Competitive;Casual;Local Multiplayer;Fighting
787860,Farming Simulator 19,Giants Software,Giants Software,,63368,3912,0,"2,000,000 .. 5,000,000",11964,20,2811,26,1999,1999,0,4844,"English, French, Italian, German, Spanish - Spain, Czech, Dutch, Hungarian, Japanese, Korean, Polish, Portuguese - Portugal, Portuguese - Brazil, Romanian, Russian, Simplified Chinese, Traditional Chinese, Turkish",Simulation,Simulation;Farming Sim;Multiplayer;Agriculture;Realistic;Open World;Driving;Singleplayer;Management;Automobile Sim;Moddable;Co-op;Resource Management;Relaxing;First-Person;Online Co-Op;Economy;Family Friendly;Atmospheric;Strategy
482730,Football Manager 2017,Sports Interactive,SEGA,,6538,4503,0,"2,000,000 .. 5,000,000",32333,0,29480,0,0,0,0,837,"English, French, Italian, Spanish - Spain, Czech, Danish, Dutch, Greek, Korean, Norwegian, Polish, Portuguese - Portugal, Russian, Swedish, Turkish, Simplified Chinese, Traditional Chinese",Simulation;Sports,Sports;Football (Soccer);Simulation;Football (American);Management;Strategy;Tactical;Multiplayer;Singleplayer;Casual;Action
47890,The Sims 3,The Sims Studio,Electronic Arts,,25129,3889,0,"2,000,000 .. 5,000,000",9000,0,777,0,1999,1999,0,1718,"English, Czech, Danish, Dutch, Finnish, French, German, Hungarian, Italian, Korean, Norwegian, Polish, Portuguese - Portugal, Russian, Spanish - Spain, Swedish, Traditional Chinese",Simulation,Life Sim;Simulation;Character Customization;Building;Sandbox;Singleplayer;Casual;Funny;Moddable;RPG;Romance;Family Friendly;Comedy;Adventure;Replay Value;Multiplayer;Nudity;Great Soundtrack;Strategy;Action
464920,Surviving Mars,"Haemimont Games, Abstraction",Paradox Interactive,,20246,3673,0,"2,000,000 .. 5,000,000",1311,219,221,219,2999,2999,0,962,"English, French, German, Spanish - Spain, Polish, Portuguese - Brazil, Russian, Simplified Chinese, Turkish",Simulation;Strategy,Colony Sim;City Builder;Strategy;Survival;Space;Base-Building;Mars;Simulation;Sci-fi;Resource Management;Singleplayer;Building;Management;Sandbox;Space Sim;Futuristic;RTS;Open World;Great Soundtrack;Moddable
337000,Deus Ex: Mankind Divided,"Eidos Montreal, Feral Interactive (Linux), Feral Interactive (Mac)","Eidos Interactive Corp., Feral Interactive (Linux), Feral Interactive (Mac)",,28464,9448,0,"2,000,000 .. 5,000,000",1273,1247,468,1247,2999,2999,0,304,"English, French, Italian, German, Spanish - Spain, Polish, Portuguese - Brazil, Russian",Action;RPG,Cyberpunk;Stealth;RPG;Sci-fi;Story Rich;Action;Atmospheric;Singleplayer;Futuristic;First-Person;Illuminati;FPS;Great Soundtrack;Shooter;Open World;Conspiracy;Immersive Sim;Dystopian ;Transhumanism;Adventure
1128810,RISK: Global Domination,SMG Studio,SMG Studio,,25248,5477,0,"2,000,000 .. 5,000,000",305,87,139,100,0,0,0,2246,"English, French, Italian, German, Spanish - Spain, Russian, Simplified Chinese, Turkish, Portuguese - Brazil",Casual;Free to Play;Strategy,Free to Play;Multiplayer;Board Game;Strategy;Turn-Based Strategy;War;Turn-Based;Tactical;Casual;Singleplayer;Turn-Based Tactics;Tabletop;Local Co-Op;Classic;Indie;Online Co-Op;Grand Strategy;Local Multiplayer;Psychological Horror;Massively Multiplayer
22370,Fallout 3: Game of the Year Edition,Bethesda Game Studios,Bethesda Softworks,,32069,8074,0,"2,000,000 .. 5,000,000",859,121,240,241,1999,1999,0,574,"English, French, German, Italian, Spanish - Spain",RPG,Open World;RPG;Post-apocalyptic;Singleplayer;Moddable;First-Person;Sci-fi;FPS;Action;Adventure;Exploration;Replay Value;Atmospheric;Sandbox;Third Person;Story Rich;Shooter;Cult Classic;Action RPG;Great Soundtrack
261570,Ori and the Blind Forest,Moon Studios GmbH,Xbox Game Studios,,47852,2337,0,"2,000,000 .. 5,000,000",643,338,357,675,0,0,0,258,"English, French, Italian, German, Spanish - Spain, Japanese, Russian, Simplified Chinese, Portuguese - Brazil",Action,Great Soundtrack;Atmospheric;Platformer;Adventure;Story Rich;Metroidvania;Fantasy;Cute;2D;Singleplayer;Difficult;Action;Indie;Puzzle-Platformer;Exploration;Puzzle;Side Scroller;Open World;Family Friendly;RPG
386180,Crossout,Targem Games,Gaijin Distribution KFT,,41789,12473,0,"2,000,000 .. 5,000,000",2225,595,200,921,0,0,0,10059,"English, Russian, German, Spanish - Spain, Japanese, Thai, French",Action;Free to Play;Massively Multiplayer;Racing,Free to Play;Vehicular Combat;Combat Racing;Co-op;Sandbox;Online Co-Op;Action;Combat;Multiplayer;Racing;Crafting;Building;Post-apocalyptic;PvP;Massively Multiplayer;Driving;Adventure;Destruction;Third Person;Survival
976310,Mortal Kombat 11,"NetherRealm Studios, QLOC, Shiver","Warner Bros. Games, Warner Bros. Interactive Entertainment",,64370,9562,0,"2,000,000 .. 5,000,000",2607,144,848,209,4999,4999,0,1777,"English, French, Italian, German, Spanish - Spain, Arabic, Polish, Portuguese - Brazil, Russian, Simplified Chinese, Spanish - Latin America, Traditional Chinese",Action,Fighting;Gore;Violent;Multiplayer;Blood;Action;2D Fighter;Mature;Competitive;Local Multiplayer;Character Customization;Singleplayer;Story Rich;Great Soundtrack;Atmospheric;Sexual Content;Arcade;Cute;2.5D;Horror
1144200,Ready or Not,VOID Interactive,VOID Interactive,,93497,8559,0,"2,000,000 .. 5,000,000",857,261,484,104,3999,3999,0,3210,"English, French, German, Czech, Korean, Simplified Chinese",Action;Adventure;Indie;Early Access,Tactical;Realistic;FPS;Multiplayer;Shooter;Co-op;Singleplayer;First-Person;Action;Horror;Violent;Gun Customization;Combat;Crime;Modern;Gore;Atmospheric;America;Co-op Campaign;Early Access
204450,Call of Juarez: Gunslinger,Techland,Techland Publishing,,30554,1589,0,"2,000,000 .. 5,000,000",419,27,210,27,1499,1499,0,106,"English, German, French, Italian, Spanish - Spain, Russian, Japanese, Polish, Portuguese - Brazil",Action,Western;FPS;Action;Shooter;Singleplayer;Story Rich;Bullet Time;Comedy;First-Person;Narration;Adventure;Dynamic Narration;Funny;Violent;Atmospheric;Arcade;Gore;America;Alternate History;Historical
686810,Hell Let Loose,Black Matter Pty Ltd,Team17,,81520,13624,0,"2,000,000 .. 5,000,000",2795,487,782,415,3999,3999,0,8437,"English, French, German, Spanish - Spain, Russian, Simplified Chinese, Polish, Portuguese - Brazil, Traditional Chinese, Korean, Japanese",Action;Indie;Massively Multiplayer;Simulation;Strategy,Shooter;FPS;World War II;Action;Realistic;Multiplayer;War;Singleplayer;Military;Tactical;Simulation;First-Person;Massively Multiplayer;PvP;Strategy;Historical;Gore;Mature;Violent;Indie
47780,Dead Space 2,Visceral Games,Electronic Arts,,19733,1239,0,"2,000,000 .. 5,000,000",571,3,234,3,1999,1999,0,78,"English, French, German, Italian, Russian, Spanish - Spain, Japanese",Action;Adventure,Horror;Survival Horror;Third-Person Shooter;Shooter;Third Person;Survival;Action;Story Rich;Sci-fi;Space;Atmospheric;Multiplayer;Singleplayer;Aliens;Futuristic;Adventure;Combat;Gore;Co-op;Blood
238010,Deus Ex: Human Revolution - Director's Cut,Eidos Montreal,Eidos Interactive Corp.,,23324,1998,0,"2,000,000 .. 5,000,000",988,0,434,0,1999,1999,0,178,"English, French, Italian, German, Spanish - Spain",Action;RPG,Cyberpunk;Stealth;RPG;Sci-fi;FPS;Action;Singleplayer;Story Rich;Great Soundtrack;Transhumanism;Dystopian ;First-Person;Atmospheric;Adventure;Inventory Management;Immersive;Shooter;Immersive Sim;Futuristic;Replay Value
269210,Hero Siege,Panic Art Studios Ltd.,Panic Art Studios Ltd.,,26640,8752,0,"2,000,000 .. 5,000,000",1472,89,253,176,699,699,0,640,"English, Finnish, Portuguese - Brazil, Russian, Simplified Chinese, Japanese, Korean, German",Action;Adventure;Indie;Massively Multiplayer;RPG,RPG;Action Roguelike;Hack and Slash;Pixel Graphics;Rogue-like;Multiplayer;Indie;Action;Co-op;Adventure;Local Co-Op;2D;Rogue-lite;Top-Down;Action RPG;Massively Multiplayer;Bullet Hell;Singleplayer;Difficult;Controller
555160,Pavlov VR,Vankrupt Games,Vankrupt Games,,33642,2083,0,"2,000,000 .. 5,000,000",1085,106,271,158,2499,2499,0,489,English,Action;Indie;Early Access,VR;Shooter;Action;Multiplayer;FPS;Military;Zombies;Gore;First-Person;Singleplayer;Funny;Violent;Co-op;Competitive;Indie;Memes;PvP;Team-Based;Simulation;Early Access;VR Only
552520,Far Cry 5,"Ubisoft Montreal, Red Storm, Ubisoft Shanghai, Ubisoft Toronto, Ubisoft Kiev",Ubisoft,,109030,27014,0,"2,000,000 .. 5,000,000",2127,378,1353,324,5999,5999,0,2642,"English, French, Italian, German, Spanish - Spain, Arabic, Czech, Dutch, Japanese, Korean, Polish, Portuguese - Brazil, Russian, Simplified Chinese, Traditional Chinese",Action;Adventure,Open World;Co-op;Action;Multiplayer;FPS;Shooter;Adventure;Singleplayer;First-Person;Story Rich;Survival;Stealth;America;Exploration;Hunting;Atmospheric;Character Customization;Great Soundtrack;Sexual Content;Nudity
19680,Alice: Madness Returns,Spicy Horse Games,Electronic Arts,,11195,1375,0,"2,000,000 .. 5,000,000",474,629,301,629,1999,1999,0,367,"English, French, German, Italian, Japanese, Spanish - Spain",Action;Adventure,3D Platformer;Horror;Female Protagonist;Hack and Slash;Action-Adventure;Dark Fantasy;Platformer;Third Person;Singleplayer;Surreal;Story Rich;Noir;Gothic;Action;Fantasy;Based On A Novel;Psychological;Atmospheric;Adventure;Supernatural
10500,Total War: EMPIRE – Definitive Edition,"CREATIVE ASSEMBLY, Feral Interactive (Mac), Feral Interactive (Linux)","SEGA, Feral Interactive (Mac), Feral Interactive (Linux)",,27424,2720,0,"2,000,000 .. 5,000,000",2915,45,586,45,2499,2499,0,2958,"English, French, Italian, German, Spanish - Spain, Russian, Polish, Czech",Strategy,Strategy;Historical;Military;Grand Strategy;Turn-Based Strategy;War;Tactical;RTS;Multiplayer;Singleplayer;Turn-Based;Naval;America;Real Time Tactics;Great Soundtrack;Action;Turn-Based Tactics;Atmospheric;Classic;Adventure
224600,Defiance,Trion Worlds,Trion Worlds,,9667,3000,0,"2,000,000 .. 5,000,000",1532,0,200,0,0,0,0,2,"English, French, German",Action;Free to Play;Massively Multiplayer;RPG,Free to Play;Looter Shooter;Open World;Action;Massively Multiplayer;Multiplayer;Third-Person Shooter;RPG;Shooter;Co-op;Sci-fi;Survival;FPS;Post-apocalyptic;Online Co-Op;Adventure;MMORPG;Third Person;Singleplayer;First-Person
104900,ORION: Prelude,DANKIE,DANKIE,,21703,7156,0,"2,000,000 .. 5,000,000",205,0,156,0,99,99,0,6,English,Action;Adventure;Indie;RPG,Dinosaurs;Action;FPS;Multiplayer;Online Co-Op;Co-op;Shooter;Adventure;Indie;Open World;Sci-fi;First-Person;Team-Based;Third-Person Shooter;Singleplayer;PvP;Mechs;Epic;Third Person;Strategy
823130,Totally Accurate Battlegrounds,Landfall,Landfall,,68727,9218,0,"2,000,000 .. 5,000,000",280,64,67,64,0,0,0,629,English,Action;Free to Play;Indie,Multiplayer;Physics;Indie;Character Customization;Massively Multiplayer;Family Friendly;Simulation;Strategy;Battle Royale;FPS;Shooter;Memes;Action;PvP;Co-op;Team-Based;Sandbox;Survival;Parody ;Open World
244450,Men of War: Assault Squad 2,Digitalmindsoft,Fulqrum Publishing,,34520,3403,0,"2,000,000 .. 5,000,000",2929,108,1007,106,2999,2999,0,1685,"English, German, Russian, French, Italian, Spanish - Spain, Polish, Turkish, Simplified Chinese",Action;Simulation;Strategy,Strategy;World War II;War;Simulation;RTS;Action;Tactical;Military;Multiplayer;Real Time Tactics;Realistic;Tanks;Historical;Co-op;Singleplayer;Destruction;Atmospheric;Difficult;Classic;Adventure
1274570,DEVOUR,Straight Back Games,Straight Back Games,,55135,4937,0,"2,000,000 .. 5,000,000",368,104,236,76,499,499,0,1343,"English, French, Italian, German, Spanish - Spain, Japanese, Korean, Polish, Russian, Simplified Chinese, Spanish - Latin America, Turkish, Thai, Portuguese - Portugal, Czech, Dutch, Finnish, Norwegian, Portuguese - Brazil, Romanian, Hungarian, Slovak, Ukrainian",Indie,Horror;Online Co-Op;Multiplayer;Survival Horror;Co-op;Sexual Content;Psychological Horror;Dark;Survival;First-Person;Indie;Atmospheric;Difficult;Puzzle;Singleplayer;Gore;Stealth;Violent;VR;Action
266840,Age of Mythology: Extended Edition,"SkyBox Labs, Ensemble Studios",Xbox Game Studios,,27025,2198,0,"2,000,000 .. 5,000,000",1370,283,562,388,2999,2999,0,1979,"English, French, Italian, German, Spanish - Spain, Japanese, Korean, Traditional Chinese",Simulation;Strategy,Strategy;Mythology;RTS;Classic;Multiplayer;Nostalgia;Great Soundtrack;Singleplayer;Epic;Fantasy;Simulation;Historical;Atmospheric;Real-Time;Tactical;Story Rich;Adventure;Co-op;Remake;Action
424280,Iron Snout,SnoutUp,SnoutUp,,16630,372,0,"2,000,000 .. 5,000,000",125,35,46,35,0,0,0,18,English,Action;Free to Play;Indie,Free to Play;2D Fighter;Funny;Action;Fighting;Gore;2D;Indie;Singleplayer;Cartoon;Blood;Survival;Violent;Beat 'em up;Fast-Paced;Casual;Arcade;Cute;Difficult;Co-op
848450,Subnautica: Below Zero,Unknown Worlds Entertainment,Unknown Worlds Entertainment,,69334,6664,0,"2,000,000 .. 5,000,000",1798,546,1063,762,2999,2999,0,1175,"English, French, Italian, German, Spanish - Spain, Japanese, Korean, Portuguese - Brazil, Spanish - Latin America, Russian, Simplified Chinese, Turkish, Ukrainian, Czech, Finnish, Hungarian, Polish, Traditional Chinese, Slovak",Adventure;Indie,Open World Survival Craft;Survival;Underwater;Open World;Singleplayer;Exploration;Horror;Base-Building;Adventure;Crafting;First-Person;Survival Horror;Aliens;Sci-fi;Early Access;Atmospheric;Story Rich;Multiplayer;Great Soundtrack;Sandbox
645630,Car Mechanic Simulator 2018,Red Dot Games,PlayWay S.A.,,41392,4178,0,"1,000,000 .. 2,000,000",2140,203,598,257,1999,1999,0,527,"English, French, Italian, German, Spanish - Spain, Czech, Hungarian, Japanese, Polish, Russian, Simplified Chinese, Turkish, Portuguese - Portugal, Greek, Portuguese - Brazil, Finnish, Korean",Racing;Simulation,Simulation;Automobile Sim;Driving;Building;Realistic;Racing;Singleplayer;Multiplayer;First-Person;Sandbox;Education;Crafting;Moddable;Open World;Physics;Management;Great Soundtrack;Strategy;Memes;Co-op
1824220,Chivalry 2,Torn Banner Studios,Tripwire Presents,,19992,4434,0,"2,000,000 .. 5,000,000",1296,382,653,268,3999,3999,0,1523,"English, French, Italian, German, Spanish - Spain, Japanese, Korean, Polish, Portuguese - Brazil, Russian, Simplified Chinese, Traditional Chinese",Action,Medieval;Multiplayer;Swordplay;Action;Combat;Wargame;Hack and Slash;First-Person;War;FPS;3D;Third Person;Military;Atmospheric;Comedy;Historical;3D Fighter;Gore;Tactical;Character Customization
367500,Dragon's Dogma: Dark Arisen,Capcom,Capcom,,29353,3293,0,"2,000,000 .. 5,000,000",1321,4,372,5,2999,2999,0,813,"English, French, Italian, German, Spanish - Spain, Japanese, Traditional Chinese",Action;Adventure;RPG,RPG;Open World;Character Customization;Fantasy;Action;Adventure;Singleplayer;Action RPG;Dragons;Third Person;Dark Fantasy;Magic;Exploration;Atmospheric;Great Soundtrack;Story Rich;Difficult;JRPG;Multiplayer;Hack and Slash
900883,The Elder Scrolls IV: Oblivion Game of the Year Edition Deluxe,Bethesda Game Studios®,Bethesda Softworks,,38574,1762,0,"2,000,000 .. 5,000,000",0,0,0,0,1999,1999,0,0,English,None,RPG;Open World;Fantasy;Singleplayer;Moddable;First-Person;Adventure;Exploration;Great Soundtrack;Magic;Action;Character Customization;Story Rich;Atmospheric;Medieval;Sandbox;Classic;Action RPG;Third Person;Dark Fantasy
431240,Golf With Your Friends,"Blacklight Interactive, Team17",Team17,,50332,6137,0,"2,000,000 .. 5,000,000",672,296,362,408,1499,1499,0,1215,"English, French, Italian, German, Spanish - Spain, Portuguese - Brazil, Russian, Simplified Chinese, Traditional Chinese, Japanese",Casual;Indie;Sports,Multiplayer;Casual;Mini Golf;Sports;Golf;Indie;Funny;Family Friendly;Early Access;Co-op;Singleplayer;Physics;Strategy;Simulation;Great Soundtrack;Difficult;Local Multiplayer;Memes;Massively Multiplayer;Horror
274190,Broforce,Free Lives,Devolver Digital,,50216,1516,0,"2,000,000 .. 5,000,000",657,200,294,200,1499,1499,0,224,"English, French, Italian, German, Spanish - Spain, Japanese, Korean, Portuguese - Brazil, Simplified Chinese",Action;Adventure;Casual;Indie,America;Action;Pixel Graphics;Co-op;2D;Local Co-Op;Platformer;Multiplayer;Indie;Shooter;Side Scroller;Funny;Local Multiplayer;Retro;Gore;Comedy;Adventure;Arcade;Casual;Epic
282140,SOMA,Frictional Games,Frictional Games,,33738,1419,0,"2,000,000 .. 5,000,000",1114,0,371,0,2999,2999,0,64,"English, French, Italian, German, Spanish - Spain, Portuguese - Brazil, Russian, Simplified Chinese",Action;Adventure;Indie,Horror;Psychological Horror;Survival Horror;Atmospheric;Exploration;Dark;Gore;Lovecraftian;Puzzle;First-Person;Adventure;Sci-fi;Story Rich;Indie;Singleplayer;Walking Simulator;Action;Mystery;Drama;Philosophical
307690,Sleeping Dogs: Definitive Edition,"United Front Games, Feral Interactive (Mac)","Square Enix, Feral Interactive (Mac)",,48793,3837,0,"2,000,000 .. 5,000,000",903,489,483,577,1999,1999,0,557,"English, French, Italian, German, Spanish - Spain, Polish, Russian",Action;Adventure;Racing,Open World;Action;Martial Arts;Crime;Singleplayer;Third Person;Story Rich;Adventure;Parkour;Multiplayer;Gore;Racing;Atmospheric;Mature;Shooter;Sandbox;Third-Person Shooter;Great Soundtrack;Fighting;Remake
389430,Knight Online,"Noah System, Mgame",NTTGame,,5077,5154,0,"1,000,000 .. 2,000,000",693,0,30,0,0,0,0,1099,"English, Turkish",Action;Adventure;Free to Play;Massively Multiplayer;RPG,Free to Play;MMORPG;Massively Multiplayer;Action;Open World;PvP;Multiplayer;Adventure;RPG;Action-Adventure;War;Strategy;Survival;Action RPG;Character Customization;Casual;Fantasy;Anime;Horror;MOBA
17470,Dead Space (2008),EA Redwood Shores,Electronic Arts,,22539,2084,0,"2,000,000 .. 5,000,000",338,0,150,0,1999,1999,0,76,"English, French, German, Italian, Spanish - Spain",Action;Adventure,Horror;Sci-fi;Action;Space;Survival Horror;Third Person;Atmospheric;Singleplayer;Third-Person Shooter;Gore;Shooter;Aliens;Dark;Futuristic;Story Rich;Silent Protagonist;Survival;Adventure;Zombies;Immersive
368230,Kingdom: Classic,"Noio, Licorice",Raw Fury,,18149,1880,0,"2,000,000 .. 5,000,000",368,231,232,231,0,0,0,77,"English, French, Italian, German, Spanish - Spain, Danish, Finnish, Norwegian, Portuguese - Brazil, Swedish",Indie;Simulation;Strategy,Free to Play;Singleplayer;Simulation;Strategy;Base-Building;Building;RPG;2D;Management;Resource Management;Fantasy;Casual;Survival;Adventure;Pixel Graphics;City Builder;Indie;Colony Sim;Tower Defense;Atmospheric
394510,HELLDIVERS Dive Harder Edition,Arrowhead Game Studios,PlayStation PC LLC,,21749,2032,0,"2,000,000 .. 5,000,000",1265,9,300,9,1999,1999,0,506,"English, French, Italian, German, Spanish - Spain, Japanese, Russian, Swedish, Danish, Finnish, Norwegian, Polish, Portuguese - Portugal, Portuguese - Brazil, Traditional Chinese, Dutch, Korean, Simplified Chinese, Spanish - Latin America",Action,Online Co-Op;Co-op;Top-Down Shooter;Twin Stick Shooter;Local Co-Op;Action;Multiplayer;Sci-fi;4 Player Local;Top-Down;Comedy;Shooter;Funny;Space;Difficult;Strategy;Mechs;Survival;Isometric;Hack and Slash
527230,For The King,IronOak Games,Curve Games,,28956,3644,0,"2,000,000 .. 5,000,000",1390,323,987,551,1999,1999,0,2335,"English, French, Italian, German, Spanish - Spain, Portuguese - Brazil, Russian, Simplified Chinese, Traditional Chinese, Polish, Japanese, Korean",Adventure;Indie;RPG;Strategy,RPG;Open World;Strategy;Online Co-Op;Rogue-like;Turn-Based;Multiplayer;Co-op;Turn-Based Combat;Adventure;Tabletop;Rogue-lite;Turn-Based Strategy;Party-Based RPG;Indie;Board Game;Fantasy;Local Co-Op;Hex Grid;Strategy RPG
40990,Mafia,Illusion Softworks,2K,,10348,1530,0,"2,000,000 .. 5,000,000",170,0,29,0,494,1499,67,171,"English, French, German, Italian, Spanish - Spain, Czech, Polish, Russian",Action;Adventure,Action;Classic;Crime;Open World;Story Rich;Atmospheric;Singleplayer;Third Person;Great Soundtrack;Adventure;Violent;Third-Person Shooter;Shooter;Difficult;Multiplayer;Racing;Cult Classic;Historical;Drama;Controller
433340,Slime Rancher,Monomi Park,Monomi Park,,103579,2220,0,"2,000,000 .. 5,000,000",1688,12,574,23,1999,1999,0,906,"English, French, German, Russian, Swedish, Simplified Chinese, Japanese, Portuguese - Brazil, Korean, Spanish - Latin America",Action;Adventure;Indie;Simulation,Cute;Exploration;Adventure;Singleplayer;Open World;First-Person;Colorful;Funny;Sandbox;Simulation;Casual;Fantasy;Management;Indie;Family Friendly;Great Soundtrack;Female Protagonist;Early Access;Action;FPS
